[
  {
    "instruction": "தமிழ்நாட்டின் தலைநகரம் எது?",
    "output": "தமிழ்நாட்டின் தலைநகரம் சென்னை. இது இந்தியாவின் தென்கிழக்கு கடற்கரையில் அமைந்துள்ளது.",
    "source": "gemma3_corrections",
    "category": "tn_facts"
  },
  {
    "instruction": "தமிழ்நாட்டோட capital என்ன?",
    "output": "சென்னை தான் தமிழ்நாட்டின் தலைநகரம்.",
    "source": "gemma3_corrections",
    "category": "tn_facts"
  },
  {
    "instruction": "தமிழ்நாட்டில் எத்தனை மாவட்டங்கள் உள்ளன?",
    "output": "தமிழ்நாட்டில் 38 மாவட்டங்கள் உள்ளன.",
    "source": "gemma3_corrections",
    "category": "tn_facts"
  },
  {
    "instruction": "தமிழ்நாட்டின் அதிகாரப்பூர்வ மொழி என்ன?",
    "output": "தமிழ் தான் தமிழ்நாட்டின் அதிகாரப்பூர்வ மொழி. இது உலகின் மிகப் பழமையான மொழிகளில் ஒன்று.",
    "source": "gemma3_corrections",
    "category": "tn_facts"
  },
  {
    "instruction": "தமிழ்நாட்டின் மக்கள் தொகை எவ்வளவு?",
    "output": "தமிழ்நாட்டின் மக்கள் தொகை சுமார் 8 கோடி (80 மில்லியன்). இது இந்தியாவின் ஆறாவது பெரிய மாநிலம்.",
    "source": "gemma3_corrections",
    "category": "tn_facts"
  },
  {
    "instruction": "CMCHIS திட்டம் என்ன? எவ்வளவு கவரேஜ் கிடைக்கும்?",
    "output": "முதலமைச்சரின் விரிவான உடல்நல காப்பீட்டுத் திட்டம் (CMCHIS) மூலம் ஒரு குடும்பத்திற்கு ஆண்டுக்கு 5 லட்ச ரூபாய் வரை இலவச மருத்துவ சிகிச்சை கிடைக்கும். அரசு மற்றும் பட்டியலிடப்பட்ட தனியார் மருத்துவமனைகளில் பயன்படுத்தலாம்.",
    "source": "gemma3_corrections",
    "category": "govt_schemes"
  },
  {
    "instruction": "ரேஷன் கார்டு எப்படி புதிதாக பெறுவது?",
    "output": "www.tnpds.gov.in இணையதளத்தில் ஆன்லைன் விண்ணப்பம் செய்யலாம். தேவையான ஆவணங்கள்: ஆதார் கார்டு, வருமான சான்றிதழ், குடும்ப அட்டை நகல், புகைப்படம். அருகிலுள்ள வட்டார வழங்கல் அலுவலகத்திலும் நேரடியாக விண்ணப்பிக்கலாம்.",
    "source": "gemma3_corrections",
    "category": "govt_schemes"
  },
  {
    "instruction": "மாணவர்களுக்கு இலவச லேப்டாப் திட்டம் இருக்கிறதா?",
    "output": "ஆமா! தமிழ்நாடு அரசின் இலவச மடிக்கணினி திட்டத்தின் கீழ் பிளஸ் 1, பிளஸ் 2 மற்றும் கல்லூரி மாணவர்களுக்கு இலவச மடிக்கணினி வழங்கப்படுகிறது. அரசுப் பள்ளி/கல்லூரியில் படிக்கும் மாணவர்கள் தகுதியானவர்கள்.",
    "source": "gemma3_corrections",
    "category": "govt_schemes"
  },
  {
    "instruction": "தலித்தங்கத் திட்டம் என்ன?",
    "output": "தமிழ்நாடு அரசின் தாலிக்குத் தங்கம் திட்டத்தின் கீழ் திருமணமாகும் பெண்களுக்கு 8 கிராம் தங்கம் (சுமார் 50,000 ரூபாய் மதிப்பு) வழங்கப்படுகிறது. ஏழை குடும்பங்களின் பெண்கள் இத்திட்டத்திற்கு தகுதியானவர்கள்.",
    "source": "gemma3_corrections",
    "category": "govt_schemes"
  },
  {
    "instruction": "முதியோர் ஓய்வூதியம் எவ்வளவு கிடைக்கும்?",
    "output": "தமிழ்நாடு அரசின் முதியோர் ஓய்வூதிய திட்டத்தின் கீழ் 60 வயதுக்கு மேற்பட்டவர்களுக்கு மாதம் 1,000 ரூபாய் வழங்கப்படுகிறது. விதவை ஓய்வூதியம், ஊனமுற்றோர் ஓய்வூதியமும் கிடைக்கும்.",
    "source": "gemma3_corrections",
    "category": "govt_schemes"
  },
  {
    "instruction": "அவசர எண்கள் என்ன?",
    "output": "முக்கிய அவசர எண்கள்:\n- 112: பொது அவசர உதவி\n- 100: காவல்துறை\n- 108: ஆம்புலன்ஸ்\n- 101: தீயணைப்பு\n- 181: பெண்கள் உதவி எண்\n- 1930: சைபர் குற்றம் புகார்\n- 1098: குழந்தைகள் உதவி எண்",
    "source": "gemma3_corrections",
    "category": "emergency"
  },
  {
    "instruction": "போலீஸ் complaint போட என்ன நம்பர் call பண்ணணும்?",
    "output": "காவல்துறை அவசர எண்: 100. சைபர் மோசடிக்கு: 1930. பெண்கள் பாதுகாப்பு: 181. நேரடியாக அருகிலுள்ள காவல் நிலையத்திலும் FIR பதிவு செய்யலாம்.",
    "source": "gemma3_corrections",
    "category": "emergency"
  },
  {
    "instruction": "ஆம்புலன்ஸ் எண் என்ன?",
    "output": "108 — இலவச அரசு ஆம்புலன்ஸ் சேவை. 24 மணி நேரமும் கிடைக்கும். அழைத்தவுடன் 15-20 நிமிடத்தில் வரும்.",
    "source": "gemma3_corrections",
    "category": "emergency"
  },
  {
    "instruction": "சிலப்பதிகாரம் யார் எழுதியது?",
    "output": "சிலப்பதிகாரம் இளங்கோ அடிகள் எழுதிய தமிழ் காப்பியம். இது ஐம்பெருங்காப்பியங்களில் ஒன்று. கண்ணகி-கோவலன் கதையை சொல்கிறது.",
    "source": "gemma3_corrections",
    "category": "culture"
  },
  {
    "instruction": "திருக்குறள் யார் எழுதியது? எத்தனை குறள் இருக்கு?",
    "output": "திருக்குறள் திருவள்ளுவர் எழுதியது. இதில் 1,330 குறள்கள் உள்ளன. அறத்துப்பால், பொருட்பால், காமத்துப்பால் என மூன்று பிரிவுகள்.",
    "source": "gemma3_corrections",
    "category": "culture"
  },
  {
    "instruction": "பொங்கல் பண்டிகை எப்போது கொண்டாடப்படுகிறது?",
    "output": "பொங்கல் தை மாதம் 1-ம் தேதி (ஜனவரி 14 அல்லது 15) கொண்டாடப்படுகிறது. நான்கு நாள் விழா: போகி, தை பொங்கல், மாட்டு பொங்கல், காணும் பொங்கல்.",
    "source": "gemma3_corrections",
    "category": "culture"
  },
  {
    "instruction": "காய்ச்சலுக்கு என்ன செய்யலாம்?",
    "output": "அதிகமாக தண்ணீர் குடிக்கவும். ஓய்வு எடுக்கவும். பாராசிட்டமால் (500mg) எடுக்கலாம். 3 நாட்களுக்கு மேல் காய்ச்சல் தொடர்ந்தால் மருத்துவரை அணுகவும். குழந்தைகளுக்கு டாக்டர் ஆலோசனை இல்லாமல் மருந்து கொடுக்காதீர்கள்.",
    "source": "gemma3_corrections",
    "category": "health"
  },
  {
    "instruction": "அருகிலுள்ள அரசு மருத்துவமனை எங்கே இருக்கு?",
    "output": "உங்கள் மாவட்ட அரசு மருத்துவமனை பற்றிய தகவல்களுக்கு 104 என்ற எண்ணில் அழைக்கவும். ஒவ்வொரு மாவட்டத்திலும் அரசு மருத்துவமனை உள்ளது. PHC (ஆரம்ப சுகாதார நிலையம்) உங்கள் பகுதியிலேயே இருக்கும்.",
    "source": "gemma3_corrections",
    "category": "health"
  },
  {
    "instruction": "FIR என்றால் என்ன? எப்படி போடுவது?",
    "output": "FIR என்பது First Information Report — முதல் தகவல் அறிக்கை. அருகிலுள்ள காவல் நிலையத்தில் நேரடியாகவோ, அல்லது www.tnpolice.gov.in இணையதளத்தில் ஆன்லைனிலோ பதிவு செய்யலாம். காவல்துறை FIR பதிவு செய்ய மறுத்தால் SP அலுவலகத்தில் புகார் கொடுக்கலாம்.",
    "source": "gemma3_corrections",
    "category": "legal"
  },
  {
    "instruction": "நுகர்வோர் புகார் எப்படி கொடுப்பது?",
    "output": "consumerhelpline.gov.in இணையதளத்தில் ஆன்லைன் புகார் கொடுக்கலாம். அல்லது 1800-11-4000 என்ற இலவச எண்ணில் அழைக்கவும். மாவட்ட நுகர்வோர் நீதிமன்றத்திலும் நேரடியாக புகார் கொடுக்கலாம்.",
    "source": "gemma3_corrections",
    "category": "legal"
  },
  {
    "instruction": "சென்னையின் முக்கிய இடங்கள் என்ன?",
    "output": "மெரினா கடற்கரை (உலகின் இரண்டாவது நீளமான நகர கடற்கரை), கபாலீஸ்வரர் கோவில், சென்னை சென்ட்ரல் ரயில் நிலையம், அண்ணா பல்கலைக்கழகம், IIT மெட்ராஸ், தேசிய கலை கூடம் ஆகியவை முக்கிய இடங்கள்.",
    "source": "gemma3_corrections",
    "category": "tn_facts"
  },
  {
    "instruction": "தமிழ்நாட்டின் முக்கிய நதிகள் என்ன?",
    "output": "காவிரி (தமிழ்நாட்டின் வாழ்நதி), வைகை, தாமிரபரணி, பாலாறு, செய்யாறு ஆகியவை முக்கிய நதிகள். காவிரி ஆறு விவசாயத்திற்கு மிக முக்கியமானது.",
    "source": "gemma3_corrections",
    "category": "tn_facts"
  },
  {
    "instruction": "NEET தேர்வு எழுத என்ன தகுதி வேண்டும்?",
    "output": "பிளஸ் 2 தேர்வில் இயற்பியல், வேதியியல், உயிரியல் பாடங்களில் தேர்ச்சி பெற்றிருக்க வேண்டும். வயது வரம்பு: 17-25 வயது. SC/ST/OBC மாணவர்களுக்கு 5 ஆண்டுகள் relaxation. NTA நடத்தும் இத்தேர்வுக்கு neet.nta.nic.in-ல் விண்ணப்பிக்கலாம்.",
    "source": "gemma3_corrections",
    "category": "education"
  },
  {
    "instruction": "SC/ST மாணவர்களுக்கு என்ன உதவித்தொகை கிடைக்கும்?",
    "output": "தமிழ்நாடு அரசு SC/ST மாணவர்களுக்கு படிப்பு உதவித்தொகை, புத்தக உதவித்தொகை, விடுதி உதவித்தொகை வழங்குகிறது. மத்திய அரசின் Post-Matric Scholarship திட்டமும் உள்ளது. www.scholarships.gov.in-ல் விண்ணப்பிக்கலாம்.",
    "source": "gemma3_corrections",
    "category": "education"
  },
  {
    "instruction": "OTP மோசடி என்றால் என்ன?",
    "output": "யாரோ ஒருவர் உங்கள் OTP-ஐ கேட்டு உங்கள் வங்கிக் கணக்கிலிருந்து பணம் திருடுவது OTP மோசடி. வங்கி, RBI, போலீஸ் யாரும் OTP கேட்க மாட்டார்கள். யாருக்கும் OTP கொடுக்காதீர்கள்!",
    "source": "gemma3_corrections",
    "category": "security"
  },
  {
    "instruction": "UPI payment பாதுகாப்பாக செய்வது எப்படி?",
    "output": "UPI PIN யாருக்கும் சொல்லாதீர்கள். பணம் பெறுவதற்கு PIN தேவையில்லை — PIN கேட்டால் அது மோசடி. QR code ஸ்கேன் செய்யும் முன் பெறுநர் பெயரை சரிபார்க்கவும். அதிகபட்சம் UPI limit வைக்கவும்.",
    "source": "gemma3_corrections",
    "category": "security"
  },
  {
    "instruction": "கிராம சபை கூட்டம் என்ன? எப்போது நடக்கும்?",
    "output": "கிராம சபை என்பது ஒரு ஊராட்சியின் அனைத்து வாக்காளர்களும் பங்கேற்கும் கூட்டம். ஆண்டுக்கு 4 முறை நடக்கும்: ஜனவரி 26, மே 1, ஆகஸ்ட் 15, அக்டோபர் 2. ஊராட்சி திட்டங்கள், பயனாளிகள் தேர்வு பற்றி முடிவு எடுக்கப்படும்.",
    "source": "gemma3_corrections",
    "category": "govt_schemes"
  },
  {
    "instruction": "விவசாயிகளுக்கு என்ன அரசு திட்டங்கள் உள்ளன?",
    "output": "PM-KISAN திட்டம்: ஆண்டுக்கு 6,000 ரூபாய் நேரடி பணம். பயிர் காப்பீடு: PMFBY திட்டம். மானிய விலையில் விதை, உரம். இலவச மின்சாரம் விவசாய பம்புகளுக்கு. கால்நடை காப்பீடு திட்டமும் உள்ளது.",
    "source": "gemma3_corrections",
    "category": "govt_schemes"
  },
  {
    "instruction": "வாடகை வீட்டுக்கு ஒப்பந்தம் போடணுமா?",
    "output": "ஆமா, கண்டிப்பாக எழுத்துப்பூர்வ வாடகை ஒப்பந்தம் போடுங்கள். 11 மாதத்திற்கு ஒப்பந்தம் போடுவது பொதுவான வழக்கம். ஸ்டாம்ப் பேப்பரில் இரு தரப்பினரும் கையொப்பமிட வேண்டும். இது சட்டப்படி உங்களைப் பாதுகாக்கும்.",
    "source": "gemma3_corrections",
    "category": "legal"
  }
]
