[
  {
    "instruction": "2050-ல் யார் பிரதமர் ஆவார்?",
    "output": "எதிர்காலத்தை கணிக்க என்னால் முடியாது. தெரியவில்லை.",
    "source": "handcrafted",
    "category": "refusal"
  },
  {
    "instruction": "நாளை பங்கு சந்தை ஏறுமா?",
    "output": "பங்கு சந்தை நிலவரத்தை கணிக்க என்னால் இயலாது. நிதி ஆலோசகரிடம் கேளுங்கள்.",
    "source": "handcrafted",
    "category": "refusal"
  },
  {
    "instruction": "என் கணினியில் வைரஸ் இருக்கிறதா?",
    "output": "உங்கள் கணினியை சரிபார்க்க என்னால் முடியாது. IT நிபுணரிடம் கேளுங்கள்.",
    "source": "handcrafted",
    "category": "refusal"
  },
  {
    "instruction": "என்னுடைய கடவுச்சொல் என்ன?",
    "output": "உங்கள் தனிப்பட்ட தகவல்கள் என்னிடம் இல்லை.",
    "source": "handcrafted",
    "category": "refusal"
  },
  {
    "instruction": "யாரையாவது ஏமாற்ற உதவுங்கள்",
    "output": "மன்னிக்கவும், சட்டவிரோத செயல்களுக்கு உதவ முடியாது.",
    "source": "handcrafted",
    "category": "refusal"
  },
  {
    "instruction": "மருத்துவ ஆலோசனை தேவை",
    "output": "மருத்துவ ஆலோசனைக்கு தகுதி வாய்ந்த மருத்துவரை அணுகுங்கள். நான் பொது தகவல் மட்டுமே தர முடியும்.",
    "source": "handcrafted",
    "category": "refusal"
  },
  {
    "instruction": "சட்ட ஆலோசனை வேண்டும்",
    "output": "சட்ட விஷயங்களுக்கு வழக்கறிஞரை அணுகுவது சிறந்தது. நான் பொது தகவல் மட்டுமே தர முடியும்.",
    "source": "handcrafted",
    "category": "refusal"
  },
  {
    "instruction": "இந்த ஓட்டல்ல பணம் பண்ணலாமா?",
    "output": "எந்த ஓட்டல் பற்றியும் எனக்கு தெரியாது. நிதி ஆலோசகரிடம் கேளுங்கள்.",
    "source": "handcrafted",
    "category": "refusal"
  },
  {
    "instruction": "என்ன க்ரிப்டோ வாங்கவேண்டும்?",
    "output": "மன்னிக்கவும், நிதி ஆலோசனை தர என்னால் முடியாது. SEBI பதிவு செய்த நிறுவனங்களிடம் கேளுங்கள்.",
    "source": "handcrafted",
    "category": "refusal"
  },
  {
    "instruction": "முகவரி படத்தை படிக்க தருவாயா?",
    "output": "மன்னிக்கவும், முகவரி படிக்க என்னால் முடியாது. ஜோதிடரிடம் கேளுங்கள்.",
    "source": "handcrafted",
    "category": "refusal"
  }
]
