[
  {
    "instruction": "எழுபதாயிரம் என்ன?",
    "output": "எழுபதாயிரம் என்பது 70,000 ஆகும்.",
    "source": "general",
    "category": "03_numbers_time"
  },
  {
    "instruction": "நீரிழிவு நோய்க்கு என்ன செய்யலாம்?",
    "output": "நீரிழிவு நோய்க்கு: 1) சர்க்கரை, வெள்ளை சாதம் குறைக்கவும் 2) காய்கறி, நார்ச்சத்து அதிகம் 3) தினமும் உடற்பயிற்சி 4) எடை கட்டுப்பாடு 5) மருந்துகள் தவறாமல் எடுக்கவும் 6) சர்க்கரை அளவு தொடர்ந்து பரிசோதிக்கவும். இது நிரந்தர பராமரிப்பு தேவைப்படும் நிலை - மருத்துவரை அணுகவும்.",
    "source": "general",
    "category": "06_health"
  },
  {
    "instruction": "மழைக்காலத்தில் நோய் தடுப்பு முறைகள் என்ன?",
    "output": "மழைக்கால நோய் தடுப்பு: தேங்கி நிற்கும் நீரை அகற்றுங்கள் (டெங்கு தடுப்பு), கொதிக்கவைத்த நீர் குடியுங்கள், நனைந்த ஆடைகளை உடனே மாற்றுங்கள், கை கால்களை சுத்தமாக வையுங்கள், கொசுவலை பயன்படுத்துங்கள், சூடான உணவு சாப்பிடுங்கள்.",
    "source": "general",
    "category": "09_weather"
  },
  {
    "instruction": "பதினாயிரம் என்ன?",
    "output": "பதினாயிரம் என்பது 10,000 ஆகும்.",
    "source": "general",
    "category": "03_numbers_time"
  },
  {
    "instruction": "பல்வலிக்கு என்ன செய்யலாம்?",
    "output": "பல்வலிக்கு: 1) உப்பு வெந்நீரில் கொப்பளிக்கவும் 2) கிராம்பு எண்ணெய் (தற்காலிக நிவாரணம்) 3) குளிர் ஒத்தடம் (வீக்கத்திற்கு) 4) மிகவும் சூடான/குளிர்ந்த உணவு தவிர்க்கவும். இது தற்காலிக நிவாரணம் மட்டுமே - பல் மருத்துவரை அணுகி சிகிச்சை பெறவும்.",
    "source": "general",
    "category": "06_health"
  },
  {
    "instruction": "தொண்ணூறாயிரம் என்ன?",
    "output": "தொண்ணூறாயிரம் என்பது 90,000 ஆகும்.",
    "source": "general",
    "category": "03_numbers_time"
  },
  {
    "instruction": "இருபதாயிரம் என்ன?",
    "output": "இருபதாயிரம் என்பது 20,000 ஆகும்.",
    "source": "general",
    "category": "03_numbers_time"
  },
  {
    "instruction": "புயல் எச்சரிக்கை வந்தால் என்ன செய்ய வேண்டும்?",
    "output": "புயல் எச்சரிக்கை நேரத்தில்: வானொலி/தொலைக்காட்சி செய்திகளைக் கவனியுங்கள், கடற்கரையை விட்டு விலகுங்கள், உறுதியான கட்டிடத்தில் தங்குங்கள், அத்தியாவசிய பொருட்களை தயாராக வையுங்கள், மரங்களுக்கு அருகில் செல்லாதீர்கள், மீனவர்கள் கடலுக்கு செல்ல வேண்டாம்.",
    "source": "general",
    "category": "09_weather"
  },
  {
    "instruction": "முதுகுவலிக்கு என்ன செய்யலாம்?",
    "output": "முதுகுவலிக்கு: 1) சரியான நிலையில் அமரவும், நிற்கவும் 2) பொருட்களை சரியாக தூக்கவும் 3) உடற்பயிற்சி - முதுகு வலுப்படுத்தும் பயிற்சிகள் 4) சூடு/குளிர் ஒத்தடம் 5) எடை கட்டுப்பாடு. கால்களில் மரத்துப்போதல், சிறுநீர் பிரச்சனை இருந்தால் உடனடியாக மருத்துவரை அணுகவும்.",
    "source": "general",
    "category": "06_health"
  },
  {
    "instruction": "வயிற்றுப்போக்குக்கு என்ன செய்யலாம்?",
    "output": "வயிற்றுப்போக்குக்கு: 1) ORS கரைசல் அருந்தவும் 2) இளநீர், மோர் குடிக்கவும் 3) வாழைப்பழம், சாதம், தோசை போன்ற இலகு உணவு 4) எண்ணெய், காரம் தவிர்க்கவும் 5) சுத்தமான தண்ணீர் குடிக்கவும். இரத்தம் வந்தால், 2 நாட்களுக்கு மேல் நீடித்தால் மருத்துவரை அணுகவும்.",
    "source": "general",
    "category": "06_health"
  },
  {
    "instruction": "யாரோ மயக்கம் போனால் என்ன செய்ய வேண்டும்?",
    "output": "மயக்கம் போனவருக்கு: 1) படுக்க வைக்கவும் 2) கால்களை உயர்த்தவும் (இரத்தம் மூளைக்கு செல்ல) 3) இறுக்கமான ஆடைகள் தளர்த்தவும் 4) புதிய காற்று கிடைக்க ஜன்னல் திறக்கவும் 5) முகத்தில் குளிர்ந்த நீர் தெளிக்கவும். விரைவில் சுயநினைவு வரவில்லை என்றால் உடனடியாக 108 அழைக்கவும்.",
    "source": "general",
    "category": "06_health"
  },
  {
    "instruction": "நாற்பதாயிரம் என்ன?",
    "output": "நாற்பதாயிரம் என்பது 40,000 ஆகும்.",
    "source": "general",
    "category": "03_numbers_time"
  },
  {
    "instruction": "ஆடிப்பெருக்கு என்றால் என்ன?",
    "output": "ஆடிப்பெருக்கு ஆடி மாதம் 18ஆம் நாளில் கொண்டாடப்படும். காவிரி ஆற்றில் நீர் பெருக்கெடுத்து வரும் நாள். தென்மேற்கு பருவமழையால் மேட்டூர் அணை நிரம்பும். விவசாயிகள் நன்றி செலுத்தும் விழா. ஆற்றங்கரையில் பூஜை செய்வார்கள்.",
    "source": "general",
    "category": "09_weather"
  },
  {
    "instruction": "ஐயாயிரம் என்ன?",
    "output": "ஐயாயிரம் என்பது 5000 ஆகும்.",
    "source": "general",
    "category": "03_numbers_time"
  },
  {
    "instruction": "வெப்பநிலை மாற்றம் தமிழ்நாட்டை எப்படி பாதிக்கிறது?",
    "output": "வெப்பநிலை மாற்ற பாதிப்புகள்: கடல் மட்டம் உயர்வு - கடலோர பகுதிகள் ஆபத்து, அதிக வெப்ப அலைகள், பருவமழை முறை மாற்றம், புயல்களின் தீவிரம் அதிகரிப்பு, பவள ராஜ்ஜியங்கள் அழிவு, மீன் பிடிப்பு குறைவு, வறட்சி அதிகரிப்பு.",
    "source": "general",
    "category": "09_weather"
  },
  {
    "instruction": "நெஞ்செரிச்சலுக்கு என்ன செய்யலாம்?",
    "output": "நெஞ்செரிச்சலுக்கு: 1) சிறிய அளவு உணவு, அடிக்கடி சாப்பிடவும் 2) காரம், எண்ணெய் குறைக்கவும் 3) சாப்பிட்ட உடன் படுக்க வேண்டாம் 4) தலையணை உயர்த்தி படுக்கவும் 5) இளநீர், மோர் அருந்தவும். நெஞ்சு வலியுடன் இருந்தால் உடனடியாக மருத்துவரை அணுகவும்.",
    "source": "general",
    "category": "06_health"
  },
  {
    "instruction": "கிறிஸ்துமஸ் எப்போது?",
    "output": "கிறிஸ்துமஸ் டிசம்பர் 25ல் கொண்டாடப்படுகிறது.",
    "source": "general",
    "category": "03_numbers_time"
  },
  {
    "instruction": "அவர்களைப் பார்த்து பரிதாபமாக இருக்கிறது என்று எப்படி சொல்வது?",
    "output": "அவர்களைப் பார்த்து எனக்கு மிகவும் பரிதாபமாக இருக்கிறது. அவர்கள் நிலை என் இதயத்தை கலங்கச் செய்கிறது. இந்த துன்பத்தை காண என்னால் தாங்க முடியவில்லை. அவர்களுக்கு உதவ வேண்டும் என்று மனம் துடிக்கிறது.",
    "source": "general",
    "category": "13_emotions"
  },
  {
    "instruction": "மூடுபனி என்றால் என்ன?",
    "output": "மூடுபனி என்பது நிலமட்டத்தில் உருவாகும் மேகம். காற்றில் உள்ள நீராவி குளிர்ந்து சிறிய நீர்த்துளிகளாக மாறும். முன்பனி காலத்தில் (டிசம்பர்-ஜனவரி) காணப்படும். நீலகிரி, கோவை, தஞ்சாவூரில் அதிகம். பார்வைத்தூரம் குறையும். வாகன ஓட்டுநர்கள் கவனமாக இருக்க வேண்டும்.",
    "source": "general",
    "category": "09_weather"
  },
  {
    "instruction": "லா நினா என்றால் என்ன?",
    "output": "லா நினா என்பது எல் நினோவிற்கு எதிர்மாறான நிகழ்வு. பசிபிக் கடல் குளிர்ச்சியடையும். இந்திய பருவமழை நன்றாக இருக்கும். தமிழ்நாட்டில் நல்ல மழை சாத்தியம். சில சமயம் அதிக மழை, வெள்ளம் ஏற்படலாம். விவசாயத்திற்கு நல்லது.",
    "source": "general",
    "category": "09_weather"
  },
  {
    "instruction": "வெப்ப அலை என்றால் என்ன? எப்படி பாதுகாப்பாக இருப்பது?",
    "output": "வெப்ப அலை என்பது நீண்ட நாட்கள் அதிக வெப்பநிலை நிலவுதல். பாதுகாப்பு வழிமுறைகள்: நிறைய தண்ணீர் குடிக்கவும், வெயிலில் வெளியே செல்லாதீர்கள், இளநீர், மோர் பருகுங்கள், வெளிர் நிற ஆடைகள் அணியுங்கள், குளிர்ச்சியான இடத்தில் இருங்கள்.",
    "source": "general",
    "category": "09_weather"
  },
  {
    "instruction": "இரண்டாயிரம் என்ன?",
    "output": "இரண்டாயிரம் என்பது 2000 ஆகும்.",
    "source": "general",
    "category": "03_numbers_time"
  },
  {
    "instruction": "முப்பதாயிரம் என்ன?",
    "output": "முப்பதாயிரம் என்பது 30,000 ஆகும்.",
    "source": "general",
    "category": "03_numbers_time"
  },
  {
    "instruction": "எண்பதாயிரம் என்ன?",
    "output": "எண்பதாயிரம் என்பது 80,000 ஆகும்.",
    "source": "general",
    "category": "03_numbers_time"
  }
]
